{
  "profileId": "base/application/application-base",
  "starterId": "application-base-starter",
  "templateKind": "starter-template",
  "templateRole": "base",
  "category": "application",
  "title": "Application Base Starter Template",
  "description": "Official canonical base starter for interface applications with multi-surface-aware generation.",
  "baseTemplatePath": "shared/templates/core-starter",
  "outputTemplatePath": "shared/templates/base/starter/application-base-starter",
  "overlayPath": "shared/authoring/starter-templates/base/application/application-base/overlay",
  "removePaths": [
    "apps/runtime",
    "packages/domain",
    "packages/config",
    "packages/sdk",
    "packages/utils",
    "Dockerfile",
    "pnpm-workspace.yaml",
    "tsconfig.json"
  ]
}
